排名,事件,热度,链接
1,杨紫 马丁靴确实蛮好穿的,2922271,https://s.weibo.com//weibo?q=杨紫 马丁靴确实蛮好穿的&Refer=top
2,加拿大法院拒收孟晚舟方提交新证据,2148717,https://s.weibo.com//weibo?q=#加拿大法院拒收孟晚舟方提交新证据#&Refer=top
3,国窖1573封藏大典,2092003,https://s.weibo.com//weibo?q=#国窖1573封藏大典#&topic_ad=1&Refer=top
4,我国结婚登记人数7年连降,2022685,https://s.weibo.com//weibo?q=#我国结婚登记人数7年连降#&Refer=top
5,二月二,1892225,https://s.weibo.com//weibo?q=二月二&Refer=top
6,刘丰源,1813366,https://s.weibo.com//weibo?q=刘丰源&Refer=top
7,2021314,1661344,https://s.weibo.com//weibo?q=2021314&Refer=top
8,女职工休生育奖励假遭开除,1274536,https://s.weibo.com//weibo?q=#女职工休生育奖励假遭开除#&Refer=top
9,巴西前总统接种中国新冠疫苗,1256065,https://s.weibo.com//weibo?q=巴西前总统接种中国新冠疫苗&Refer=top
10,张哲瀚被堵在酒店门口,1241344,https://s.weibo.com//weibo?q=#张哲瀚被堵在酒店门口#&Refer=top
11,王子文 我确实有个小孩,966783,https://s.weibo.com//weibo?q=王子文 我确实有个小孩&Refer=top
12,文森佐,575931,https://s.weibo.com//weibo?q=文森佐&Refer=top
13,吴永恩,574447,https://s.weibo.com//weibo?q=吴永恩&Refer=top
14,防蓝光眼镜真能预防近视吗,536475,https://s.weibo.com//weibo?q=#防蓝光眼镜真能预防近视吗#&Refer=top
15,蔡卓宜没见到陈越,523993,https://s.weibo.com//weibo?q=#蔡卓宜没见到陈越#&Refer=top
16,央视揭有偿刷单套路,521467,https://s.weibo.com//weibo?q=#央视揭有偿刷单套路#&Refer=top
17,省考,519556,https://s.weibo.com//weibo?q=省考&Refer=top
18,10个高频词速览十四五规划纲要,512836,https://s.weibo.com//weibo?q=#10个高频词速览十四五规划纲要#&Refer=top
19,英首相拒还帕台农神庙雕塑给希腊,508123,https://s.weibo.com//weibo?q=英首相拒还帕台农神庙雕塑给希腊&Refer=top
20,女子送男友40万礼物法官灵魂拷问,504415,https://s.weibo.com//weibo?q=#女子送男友40万礼物法官灵魂拷问#&Refer=top
21,黄奕说所有美好王子文都值得拥有,502341,https://s.weibo.com//weibo?q=#黄奕说所有美好王子文都值得拥有#&Refer=top
22,2021314文案,499937,https://s.weibo.com//weibo?q=2021314文案&Refer=top
23,哈登假动作妙传小乔丹,464050,https://s.weibo.com//weibo?q=哈登假动作妙传小乔丹&Refer=top
24,哈登决胜时刻连得10分,454087,https://s.weibo.com//weibo?q=哈登决胜时刻连得10分&Refer=top
25,15岁少年景区划船落水身亡,450738,https://s.weibo.com//weibo?q=15岁少年景区划船落水身亡&Refer=top
26,火箭发射失利初中生写给科研人员的信,444581,https://s.weibo.com//weibo?q=火箭发射失利初中生写给科研人员的信&Refer=top
27,河北5名儿童遭校园暴力,417602,https://s.weibo.com//weibo?q=#河北5名儿童遭校园暴力#&Refer=top
28,谷爱凌再夺一金,402524,https://s.weibo.com//weibo?q=#谷爱凌再夺一金#&Refer=top
29,彭波接受审查调查,399563,https://s.weibo.com//weibo?q=#彭波接受审查调查#&Refer=top
30,贾乃亮调侃了半个演艺圈,399124,https://s.weibo.com//weibo?q=#贾乃亮调侃了半个演艺圈#&Refer=top
31,毛晓彤高马尾公主头,300617,https://s.weibo.com//weibo?q=毛晓彤高马尾公主头&Refer=top
32,圆周率日,292249,https://s.weibo.com//weibo?q=圆周率日&Refer=top
33,力丸直拍,286821,https://s.weibo.com//weibo?q=#力丸直拍#&Refer=top
34,洛根李给罗爱乔做人工呼吸,277414,https://s.weibo.com//weibo?q=#洛根李给罗爱乔做人工呼吸#&Refer=top
35,尤长靖新歌,211601,https://s.weibo.com//weibo?q=#尤长靖新歌#&Refer=top
36,北京四方兄弟搬家公司被起诉,209447,https://s.weibo.com//weibo?q=#北京四方兄弟搬家公司被起诉#&Refer=top
37,警方调查公寓油烟机藏摄像头,200188,https://s.weibo.com//weibo?q=#警方调查公寓油烟机藏摄像头#&Refer=top
38,和朋友喜欢上同一个人怎么办,195922,https://s.weibo.com//weibo?q=#和朋友喜欢上同一个人怎么办#&Refer=top
39,到2035年看看我们的生活,193909,https://s.weibo.com//weibo?q=#到2035年看看我们的生活#&Refer=top
40,刺杀小说家票房破10亿,188676,https://s.weibo.com//weibo?q=#刺杀小说家票房破10亿#&Refer=top
41,在方舱比心的医护夫妻有了新合照,167394,https://s.weibo.com//weibo?q=在方舱比心的医护夫妻有了新合照&Refer=top
42,创造营二创,155048,https://s.weibo.com//weibo?q=创造营二创&Refer=top
43,白敬亭可以把警服焊在身上吗,154116,https://s.weibo.com//weibo?q=#白敬亭可以把警服焊在身上吗#&Refer=top
44,漫威恭喜阿凡达重夺全球票房冠军,150406,https://s.weibo.com//weibo?q=#漫威恭喜阿凡达重夺全球票房冠军#&Refer=top
45,女子街头策马奔腾被警方约谈,149821,https://s.weibo.com//weibo?q=#女子街头策马奔腾被警方约谈#&Refer=top
46,威少42分,147637,https://s.weibo.com//weibo?q=威少42分&Refer=top
47,东京奥运会有可能零观众,146118,https://s.weibo.com//weibo?q=东京奥运会有可能零观众&Refer=top
48,数万印度人跳入恒河沐浴,145533,https://s.weibo.com//weibo?q=#数万印度人跳入恒河沐浴#&Refer=top
49,中国外交官回击BBC,131950,https://s.weibo.com//weibo?q=#中国外交官回击BBC#&Refer=top
50,菲律宾发现变异新冠病毒,131118,https://s.weibo.com//weibo?q=#菲律宾发现变异新冠病毒#&Refer=top
